{
  "schema_version": "1.0.0",
  "kind": "test-agent-validation-receipt",
  "mode": "shadow",
  "authorizes_merge": false,
  "repository": "ninghu/agent-insights-quality",
  "pr_number": 999,
  "cycle_id": "validation-shadow-r01",
  "epoch": 1,
  "final_head_sha": "bbbbbbbbbbbbbbbbbbbbbbbbbbbbbbbbbbbbbbbb",
  "final_tree_sha": "cccccccccccccccccccccccccccccccccccccccc",
  "issued_at": "2026-08-29T12:00:00Z",
  "issuer": {
    "app_id": 15368,
    "app_slug": "github-actions",
    "environment": "test-agent-validation-shadow",
    "issuer_code_digest": "sha256:42ccebbe9c9db506d2f4d2d527215c4ddda2ae69d3d09272c39a1ecdddb91ddf",
    "oidc_subject_digest": "sha256:aaaaaaaaaaaaaaaaaaaaaaaaaaaaaaaaaaaaaaaaaaaaaaaaaaaaaaaaaaaaaaaa",
    "run_attempt": 1,
    "run_id": 400,
    "workflow_commit_sha": "bbbbbbbbbbbbbbbbbbbbbbbbbbbbbbbbbbbbbbbb",
    "workflow_database_id": 300,
    "workflow_path": ".github/workflows/test-agent-validation.yml",
    "workflow_ref": "bbbbbbbbbbbbbbbbbbbbbbbbbbbbbbbbbbbbbbbb"
  },
  "trusted_policy": {
    "default_branch_trust_anchor_present": false,
    "repository": "ninghu/agent-insights-quality",
    "path": "config/test-agent-validation-policy.yaml",
    "ref": "bbbbbbbbbbbbbbbbbbbbbbbbbbbbbbbbbbbbbbbb",
    "commit_sha": "bbbbbbbbbbbbbbbbbbbbbbbbbbbbbbbbbbbbbbbb",
    "content_digest": "sha256:df0f32404e9389c585b9507d3dda1b5e1ce7962d83a9a71c419caca1767c1ba8",
    "allowed_workflow_path": ".github/workflows/test-agent-validation.yml",
    "allowed_app_id": 15368,
    "allowed_app_slug": "github-actions",
    "required_environment": "test-agent-validation-receipt",
    "required_check": "test-agent-validation"
  },
  "scope_freeze": {
    "head_sha": "bbbbbbbbbbbbbbbbbbbbbbbbbbbbbbbbbbbbbbbb",
    "tree_sha": "cccccccccccccccccccccccccccccccccccccccc",
    "frozen_at": "2026-08-29T12:10:00+00:00",
    "source_tree_digest": "sha256:7346c449276af446d346989f316aacb7d6bf67e4a1958b0564d2ef1a87144fad",
    "validation_contract_digest": "sha256:e15961ef05ac2ba6b7a4423dd7e01f6eee6c3c21c7b4c5bd9567cfe3a5cd72b8",
    "scope_digest": "sha256:2123c2a593636778cbb3deff4cc0b0c0ee3ca082428407641a75a0c3908f3739"
  },
  "review": {
    "check": null,
    "comprehensive_review_count": 0,
    "exercised_requirements": [
      "lifecycle"
    ],
    "findings_digest": null,
    "missing_requirements": [
      "comprehensive_review"
    ],
    "status": "skipped"
  },
  "required_ci": {
    "targeted_verification": {
      "app_id": 15368,
      "app_slug": "github-actions",
      "check_run_id": 2,
      "check_suite_id": 102,
      "completed_at": "2026-08-29T12:00:00Z",
      "conclusion": "success",
      "head_sha": "bbbbbbbbbbbbbbbbbbbbbbbbbbbbbbbbbbbbbbbb",
      "name": "test-agent-validation-targeted",
      "result_digest": "sha256:a13b81afdfde16e6c83f30f159d2a29855900559cbe253a4857cedcb5d525d55",
      "workflow_id": 202,
      "workflow_path": ".github/workflows/test-agent-validation-receipt.yml",
      "workflow_sha": "bbbbbbbbbbbbbbbbbbbbbbbbbbbbbbbbbbbbbbbb"
    },
    "continuous_integration": {
      "app_id": 15368,
      "app_slug": "github-actions",
      "check_run_id": 3,
      "check_suite_id": 103,
      "completed_at": "2026-08-29T12:00:00Z",
      "conclusion": "success",
      "head_sha": "bbbbbbbbbbbbbbbbbbbbbbbbbbbbbbbbbbbbbbbb",
      "name": "validate",
      "result_digest": "sha256:620521438c1aa27d20340d5596f8bb3708478794c9a46c081e0f1788be4ca991",
      "workflow_id": 203,
      "workflow_path": ".github/workflows/test-agent-validation-receipt.yml",
      "workflow_sha": "bbbbbbbbbbbbbbbbbbbbbbbbbbbbbbbbbbbbbbbb"
    }
  },
  "catalog_hashes": {
    "agents": "sha256:bae4540225ce90f2bee4e69d7ad459f7fb2f5196809c222b9d6fd37ea829c008",
    "artifacts": "sha256:c2cb33f6b10d20f5ec8eabac6cb70c0f9a5ee79fd95e31d71edb687bde7a54b7",
    "issues": "sha256:69a79eef2a741ebe07ff44a0ca571f0672bcdfc5dc629933cf55b429596509e5"
  },
  "artifact_manifest_hash": "sha256:c2cb33f6b10d20f5ec8eabac6cb70c0f9a5ee79fd95e31d71edb687bde7a54b7",
  "source_tree_digest": "sha256:7346c449276af446d346989f316aacb7d6bf67e4a1958b0564d2ef1a87144fad",
  "validation_contract_digest": "sha256:8627cf327909f9c172c3a94c65c5809360406c6bced6d90d164a7c11a8ebabcd",
  "execution_matrix_digest": "sha256:9871973a74edb8afcde6fab1985eea8e3ad43e1e9e83243e8baffe0d8ef86ccb",
  "runtime_topology_digest": "sha256:ccfc73e8252f9ca571b00947fac320bd2787850657730f6b969b1c1aa4ac175f",
  "quota_plan_digest": "sha256:aaaaaaaaaaaaaaaaaaaaaaaaaaaaaaaaaaaaaaaaaaaaaaaaaaaaaaaaaaaaaaaa",
  "evidence_digest": "sha256:8ad5522c9a91e048bdf2ab8126d2b4ba43139ab41929a3863b0687a046ddce1e",
  "telemetry_resource_set": "g29",
  "test_agent_model": {
    "deployment_name": "gpt-5.4-mini",
    "model_id": "gpt-5.4-mini",
    "model_version": "2026-03-17"
  },
  "authorities": [
    {
      "authority_id": "weather-agent/v0",
      "source_content_digest": "sha256:c86905fa1099c0fc6880ec7a98c8c29fb102b1d2ba96e3640d597b22f250af01",
      "execution_digest": "sha256:e3e48daada11192baa28764ce1e8741222afa17d04c6225f832c8f96a180bd19",
      "predicate_contract_digest": "sha256:319c98bb9ae5d72cfac8f6ba50f18b1e4c4f3d8c7029689d3e5e94742aed8cdb",
      "pass": true,
      "scenarios": [
        {
          "scenario_id": "weather-agent-baseline-health",
          "validation_mode": "baseline",
          "predicate_contract_digest": "sha256:8e42586c5f1798a20bef88a9cc8470d07ef62813c546575a368be9962833ef1b",
          "n": 5,
          "k": 5,
          "complete_count": 5,
          "observed": 0,
          "v0_complete_count": 0,
          "v0_observed": 0,
          "pass": true
        }
      ],
      "authority_evidence_digest": "sha256:f9916569d8924c7e7bd473e4e81f4a36abe45bfb46089cf006a18562c75dfbbb"
    },
    {
      "authority_id": "healthcare-agent/v0",
      "source_content_digest": "sha256:21eb0f528f98cc047f8e82c405d5ecfbe9d17168c17292c0a32c94ad9c0833d2",
      "execution_digest": "sha256:9086beb26e439c752d128d949f4e0723d490f22d30a02ae222cfac6965b0569d",
      "predicate_contract_digest": "sha256:d2658384ba91a7862d9188c6f0ce762d5f019d83e0cf502ebbe1126990375143",
      "pass": true,
      "scenarios": [
        {
          "scenario_id": "healthcare-agent-baseline-health",
          "validation_mode": "baseline",
          "predicate_contract_digest": "sha256:a03bcfdefb57605eed054934a2c8841af181ef284ad00d5626dcd38313b9192c",
          "n": 5,
          "k": 5,
          "complete_count": 5,
          "observed": 0,
          "v0_complete_count": 0,
          "v0_observed": 0,
          "pass": true
        }
      ],
      "authority_evidence_digest": "sha256:712a9adb1667d777106dd3a22129df70ee5f746fee8bd709036cb0100c642c26"
    },
    {
      "authority_id": "finance-agent/v0",
      "source_content_digest": "sha256:84b97e00049ca3dcdc169737914537d232e9788dfd922c843c297166779c32ff",
      "execution_digest": "sha256:e9112f17a7d23ade48743d836a1b4a68dc9b5ad65947fa43d611ffebcae6abf0",
      "predicate_contract_digest": "sha256:2a5d05ad0be09fd16d2b14da3ef3f5a71d13897def414cf16d3e63071a0d65b4",
      "pass": true,
      "scenarios": [
        {
          "scenario_id": "finance-agent-baseline-health",
          "validation_mode": "baseline",
          "predicate_contract_digest": "sha256:7f8622f27b97c45ee52680a596625ddd011868e4d8e824e6dd7de580948973a8",
          "n": 5,
          "k": 5,
          "complete_count": 5,
          "observed": 0,
          "v0_complete_count": 0,
          "v0_observed": 0,
          "pass": true
        }
      ],
      "authority_evidence_digest": "sha256:692f9f71765e9295b7f74b05e6fab4cdc1a2ed6101e4007c74b60344f6719e2d"
    },
    {
      "authority_id": "travel-agent/v0",
      "source_content_digest": "sha256:5802aee8256a8b52ec91463e5832d5107373cc13f88c7c38ea0c9367e4da18cb",
      "execution_digest": "sha256:3fa72749e748b778e6023cdd3c34a34f414fce8a05e5954c92688afa750e3d02",
      "predicate_contract_digest": "sha256:6b6fd21e41e36d12668c4af0d2dfa177d36523c824a164f206f5c01494defdf0",
      "pass": true,
      "scenarios": [
        {
          "scenario_id": "travel-agent-baseline-health",
          "validation_mode": "baseline",
          "predicate_contract_digest": "sha256:901a4e644863a3dcff0e09b58819a5cfe6434a10c538294f6a19faa0f6054ab1",
          "n": 5,
          "k": 5,
          "complete_count": 5,
          "observed": 0,
          "v0_complete_count": 0,
          "v0_observed": 0,
          "pass": true
        }
      ],
      "authority_evidence_digest": "sha256:38b354af0e02e065eb6610b7c41c6715cac7121ac19a5689bc1fd1f4397e33f3"
    },
    {
      "authority_id": "support-ticket-agent/v0",
      "source_content_digest": "sha256:d29c8664ad8c96e0c8b49d9da98b9d6e2154252b0dbfb9e93c0fc35bfb5d03a0",
      "execution_digest": "sha256:58c53a8ab9e66497fa704cb946e91e20fc9e37bb30bd3d200fd3a332e3049329",
      "predicate_contract_digest": "sha256:caae7fbf92da506355633654a217be67bf491d4b26c2417ff3d170e47777c62b",
      "pass": true,
      "scenarios": [
        {
          "scenario_id": "support-ticket-agent-baseline-health",
          "validation_mode": "baseline",
          "predicate_contract_digest": "sha256:13b192943bf81d94243828a4a6d8a4787cfb91218d348e5ea9e4c1a8944dd867",
          "n": 5,
          "k": 5,
          "complete_count": 5,
          "observed": 0,
          "v0_complete_count": 0,
          "v0_observed": 0,
          "pass": true
        }
      ],
      "authority_evidence_digest": "sha256:706e6cbff5b597b14ea757012c5ca6f508633985525b9954a48a7d8bbeda61aa"
    },
    {
      "authority_id": "issue-001",
      "source_content_digest": "sha256:168c26037257a2d8a65338de7708415b9b71e14bd85807a830e18400a4241c4e",
      "execution_digest": "sha256:68e45c555b819e3e0fc3802da650110c4648beb947df2ce08ef26428062d50f0",
      "predicate_contract_digest": "sha256:b4cde0ce6a3058f8bef10c752a9c325dafe895270abc1ea157ee7d4683102aa4",
      "pass": true,
      "scenarios": [
        {